{"$schema":"https://json-schema.org/draft/2020-12/schema","title":"Oracle Lab Handoff Bundle","compatibility_policy":"phase_0_additive_only_breaking_requires_new_version_and_migration_test","retention_class":"phase_evidence_permanent","redaction_policy":"digests_and_safe_redacted_excerpts_only","destruction_procedure":"git_revert_artifact_commit_after_security_approval","type":"object","additionalProperties":false,"required":["schema_version","phase","generated_at","expires_at","baseline_digest","command_results_digest","repositories","commands","artifacts","known_unknowns","retention_policy","redaction_policy","destruction_procedure"],"properties":{"schema_version":{"const":1},"phase":{"type":"string"},"generated_at":{"type":"string"},"expires_at":{"type":"string"},"baseline_digest":{"type":"string"},"command_results_digest":{"type":"string"},"context_pack_digest":{"type":"string"},"repositories":{"type":"array"},"commands":{"type":"array"},"artifacts":{"type":"array"},"known_unknowns":{"type":"array"},"retention_policy":{"type":"object"},"redaction_policy":{"type":"string"},"destruction_procedure":{"type":"string"}}}
